{
  "schema_version": "1.0.0",
  "effect_protocol_version": "2.0.0",
  "accounting_owner": "shared ConditionEventObserver over ProviderBudgetBoundary",
  "launch_mutation_authority": "launch_campaign through selected campaign_transport",
  "methods": [
    {
      "method_name": "effect_protocol_version",
      "shared_caller": "load_package_effects and ProductionCategory3World.__init__",
      "retained_primitive": "EFFECT_PROTOCOL_VERSION exact registration validation",
      "input_type": "property access",
      "output_type": "str",
      "phase": "exact identity and composition",
      "authority_owner": "shared held package loader",
      "accounting_owner": "not-applicable",
      "evidence_owner": "shared source binding",
      "pre_repair_classification": "historical compatibility only",
      "post_repair_classification": "maps directly to one retained live primitive",
      "live_mapping_complete": true
    },
    {
      "method_name": "provider_contract_version",
      "shared_caller": "ProductionCategory3World.__init__",
      "retained_primitive": "T09ProviderContract exact selector",
      "input_type": "property access",
      "output_type": "str",
      "phase": "exact identity and composition",
      "authority_owner": "shared target resolver",
      "accounting_owner": "not-applicable",
      "evidence_owner": "registry and composition",
      "pre_repair_classification": "maps directly to one retained live primitive",
      "post_repair_classification": "maps directly to one retained live primitive",
      "live_mapping_complete": true
    },
    {
      "method_name": "implementation_identity",
      "shared_caller": "load_package_effects and ProductionCategory3World.__init__",
      "retained_primitive": "PackageEffectRegistration plus HeldEffectSource",
      "input_type": "property access",
      "output_type": "EffectImplementationIdentity",
      "phase": "exact identity and composition",
      "authority_owner": "shared held package loader",
      "accounting_owner": "not-applicable",
      "evidence_owner": "shared source binding",
      "pre_repair_classification": "maps directly to one retained live primitive",
      "post_repair_classification": "maps directly to one retained live primitive",
      "live_mapping_complete": true
    },
    {
      "method_name": "runtime_clock",
      "shared_caller": "ProductionCategory3World.__init__",
      "retained_primitive": "time.monotonic, time.time, and bounded sleep adapter",
      "input_type": "property access",
      "output_type": "RuntimeClock",
      "phase": "all deadline-bearing phases",
      "authority_owner": "shared validated clock wrapper",
      "accounting_owner": "shared controller",
      "evidence_owner": "shared phase receipts",
      "pre_repair_classification": "maps directly to one retained live primitive",
      "post_repair_classification": "maps directly to one retained live primitive",
      "live_mapping_complete": true
    },
    {
      "method_name": "transaction_root",
      "shared_caller": "ProductionCategory3World.__init__",
      "retained_primitive": "HeldTransactionRoot.path",
      "input_type": "property access",
      "output_type": "Path",
      "phase": "exact identity and composition",
      "authority_owner": "shared held-root derivation",
      "accounting_owner": "not-applicable",
      "evidence_owner": "shared root attestation",
      "pre_repair_classification": "maps directly to one retained live primitive",
      "post_repair_classification": "maps directly to one retained live primitive",
      "live_mapping_complete": true
    },
    {
      "method_name": "read_model_secret",
      "shared_caller": "ProductionCategory3World.read",
      "retained_primitive": "load_openai_dotenv_assignment strict mixed-dotenv selector",
      "input_type": "held package-private secret path",
      "output_type": "bytearray",
      "phase": "exact secret reads",
      "authority_owner": "shared reserved opaque authority",
      "accounting_owner": "shared effect counters",
      "evidence_owner": "privacy-safe secret-channel receipt",
      "pre_repair_classification": "maps directly to one retained live primitive",
      "post_repair_classification": "maps directly to one retained live primitive",
      "live_mapping_complete": true
    },
    {
      "method_name": "read_provider_secret",
      "shared_caller": "ProductionCategory3World.read",
      "retained_primitive": "load_openai_dotenv_assignment strict LAMBDA_API_KEY selector",
      "input_type": "held package-private secret path",
      "output_type": "bytearray",
      "phase": "exact secret reads",
      "authority_owner": "shared reserved opaque authority",
      "accounting_owner": "shared effect counters",
      "evidence_owner": "privacy-safe secret-channel receipt",
      "pre_repair_classification": "maps directly to one retained live primitive",
      "post_repair_classification": "maps directly to one retained live primitive",
      "live_mapping_complete": true
    },
    {
      "method_name": "public_ipv4",
      "shared_caller": "ProductionCategory3World.read",
      "retained_primitive": "retained provider public-source IPv4 acquisition",
      "input_type": "explicit public observation channel",
      "output_type": "str",
      "phase": "provider inventory and launch",
      "authority_owner": "shared launch transaction",
      "accounting_owner": "shared provider request ledger",
      "evidence_owner": "retained provider lifecycle source",
      "pre_repair_classification": "maps directly to one retained live primitive",
      "post_repair_classification": "maps directly to one retained live primitive",
      "live_mapping_complete": true
    },
    {
      "method_name": "ssh_public_key",
      "shared_caller": "ProductionCategory3World.read",
      "retained_primitive": "retained exact SSH public-key loader",
      "input_type": "held public-key path",
      "output_type": "str",
      "phase": "provider inventory and launch",
      "authority_owner": "shared launch transaction",
      "accounting_owner": "not-applicable",
      "evidence_owner": "retained provider launch manifest",
      "pre_repair_classification": "maps directly to one retained live primitive",
      "post_repair_classification": "maps directly to one retained live primitive",
      "live_mapping_complete": true
    },
    {
      "method_name": "metadata_channel",
      "shared_caller": "ProductionCategory3World.request",
      "retained_primitive": "one no-redirect no-retry model metadata GET transport",
      "input_type": "model ID, mutable credential, wall time",
      "output_type": "ModelMetadataResponse",
      "phase": "sole authenticated metadata request",
      "authority_owner": "shared opaque authority transaction",
      "accounting_owner": "shared metadata controller",
      "evidence_owner": "model metadata receipt",
      "pre_repair_classification": "maps directly to one retained live primitive",
      "post_repair_classification": "maps directly to one retained live primitive",
      "live_mapping_complete": true
    },
    {
      "method_name": "metadata_authorization_binding",
      "shared_caller": "ProductionCategory3World.request",
      "retained_primitive": "validate_model_metadata_receipt authorization binding",
      "input_type": "T09ProviderContract",
      "output_type": "Mapping[str, object]",
      "phase": "sole authenticated metadata request",
      "authority_owner": "shared opaque authority transaction",
      "accounting_owner": "shared metadata controller",
      "evidence_owner": "provider-entry authority closure",
      "pre_repair_classification": "maps directly to one retained live primitive",
      "post_repair_classification": "maps directly to one retained live primitive",
      "live_mapping_complete": true
    },
    {
      "method_name": "provider_inventory",
      "shared_caller": "ProductionCategory3World.launch and cleanup",
      "retained_primitive": "t09_pragmatic_provider bounded inventory observations",
      "input_type": "explicit retained provider transport",
      "output_type": "tuple[str, ...] | None",
      "phase": "provider inventory and terminal verification",
      "authority_owner": "shared provider lifecycle",
      "accounting_owner": "shared provider request ledger",
      "evidence_owner": "provider lifecycle transaction",
      "pre_repair_classification": "maps directly to one retained live primitive",
      "post_repair_classification": "maps directly to one retained live primitive",
      "live_mapping_complete": true
    },
    {
      "method_name": "provider_entry",
      "shared_caller": "ProductionCategory3World.enter",
      "retained_primitive": "validate_entry_receipt_source_bound and exact host entry",
      "input_type": "ProviderHandle",
      "output_type": "None",
      "phase": "provider entry validation",
      "authority_owner": "shared provider lifecycle",
      "accounting_owner": "shared provider request ledger",
      "evidence_owner": "provider-entry source bundle",
      "pre_repair_classification": "maps directly to one retained live primitive",
      "post_repair_classification": "maps directly to one retained live primitive",
      "live_mapping_complete": true
    },
    {
      "method_name": "provider_cost_receipt",
      "shared_caller": "ProductionCategory3World.checkpoint",
      "retained_primitive": "validate_provider_lifecycle_cost_proof reconciliation",
      "input_type": "ProviderCostObservationRequest",
      "output_type": "ProviderCostReceipt",
      "phase": "retained first-pair checkpoint",
      "authority_owner": "shared lifecycle derivation",
      "accounting_owner": "shared provider-cost proof",
      "evidence_owner": "provider lifecycle source hashes",
      "pre_repair_classification": "maps directly to one retained live primitive",
      "post_repair_classification": "maps directly to one retained live primitive",